Breaking Free From Micromanagement,"<p>Strong leadership skills are foundational to a successful career—regardless of your role. An effective leadership approach is key for your team to reach its full potential. In this course, leadership professor Dr. Julia Milner from EDHEC Business School shares practical wisdom to help leaders recognize, handle, and prevent micromanaging in the workplace. Dr. Julia Milner is a renowned leadership expert with extensive experience in coaching and developing leaders. Find out how to recognize the underlying need for control and anxiety that often drives micromanaging behavior. Delve into the negative impacts of being micromanaged on mental health and productivity. Get started with universal principles such as recognizing micromanaging tendencies and developing strategies to prevent them. Explore techniques for handling micromanaging behavior effectively and promoting a healthier work environment. Plus, discover ways to create a supportive team culture that fosters trust and autonomy. </p>

<p>This course was created by Morra Aarons-Mele. We are pleased to host this training in our library.</p>",Course,2025-02-20 02:25 UTC,N/A,false,N/A,
Mastering Self-Motivation,"<p>Do you have a goal that's been sitting on your to-do list for months? If so, you're in good company. Professionals of all stripes struggle to take their personal goals from the drawing board to the real world. In this course—which has been updated to reflect shifts in AI, human motivation research, and emerging views towards work—leadership expert and best-selling author Selena Rezvani gives you practical, research-backed tools to stay motivated from the inside out.</p>
<p>Selena dives into what really motivates us, the science of purpose and mastery, and how to use AI tools while keeping your human touch. Learn how to identify the kind of self-motivator you are, so that you can align goal achievement with your area of motivation. Discover how to analyze common unhelpful self-talk patterns and apply cognitive behavioral therapy (CBT) techniques to motivate yourself more effectively. Plus, see how to tap into your network to ignite action; replace traditional grit with sustainable resilience; and identify work conditions that create a peak sense of flow and personal engagement.</p>",Course,2026-05-08 11:15 UTC,N/A,false,N/A,
Presenting Financial Information,"<p>Many financial professionals fail to present and communicate effectively. They overwhelm their audiences with complex content, leaving them confused. The ability to connect with an audience and communicate clearly is vital to the success of both the practitioner and the organization.</p><P>
In this course, discover how to present and communicate finance presentations effectively. Instructor Carl Seidman teaches you how to avoid overwhelming your audiences with complex content, jargon, and an abundance of information while also connecting with diverse audiences on concepts central to financial communications.",Course,2026-04-07 23:54 UTC,N/A,false,N/A,
Satya Nadella and Rishi Sunak on What Comes Next for AI,"<p>Want a front-row seat to the conversations shaping the world’s future?</p>

<p>In this conversation—recorded at the 2026 World Economic Forum in Davos, Switzerland—Microsoft Chairman and CEO Satya Nadella and former UK Prime Minister Rishi Sunak sit down with LinkedIn VP and editor in chief Daniel Roth to discuss AI’s next phase. From global leadership and business transformation to the changing nature of work, they tackle one of the defining questions of our time—who controls the future of AI, and who stands to benefit?</p>

<p>This is a recording of a live event. Visit <a href=""http://linkedin.com/events"" target=""_blank""><b>linkedin.com/events</b></a> for more can’t-miss conversations featuring prominent leaders.</p>",Course,2026-05-23 22:16 UTC,N/A,false,N/A,
Critical Thinking,"<p>Critical thinking is the ability to think reflectively and independently in order to make thoughtful decisions. By focusing on root-cause issues critical thinking helps you avoid future problems that can result from your actions. In this course, leadership trainer and expert Mike Figliuolo outlines a series of techniques to help you develop your critical thinking skills. He reveals how to define the problem you're trying to solve and then provides a number of critical thinking tools such as blowing up the business, asking the 5 whys and the 7 so whats, exploring the 80/20 rule, and more. He also provides guidance on how to develop this skill across your whole team.</p><p>This course includes AI-powered Role Play. Role Play allows you to practice what you’ve learned in interactive simulations of real-world conversations.</p>",Course,2025-05-09 18:18 UTC,2025-05-09 18:16 UTC,false,N/A,
Succeeding as an LGBT Professional,"Even in places where discrimination is illegal, there are still nuances and complexities involved in being openly LGBT at work. In this course, best-selling business author, consultant, and educator Dorie Clark shows you how to navigate them with aplomb and build a successful and thriving career. Dorie discusses how to harness the benefits of your identity and identify and overcome any limiting beliefs you may hold. She goes over pros and cons of coming out in your job search or on the job. Dorie covers ways to handle well-meaning coworkers with grace and how to connect with other LGBT professionals. She shares strategies to overcome challenges such as a very conservative company or industry, hostile coworkers, or the complexities of coming out as transgender.",Course,2022-01-04 15:18 UTC,N/A,false,N/A,
Creating a Collaborative Culture,"<p>Discover why a collaborative work environment can promote success, and learn how to create a cooperative culture in the workplace. Author, CEO and instructor Lisa Bodell outlines the benefits of collaboration, and shares techniques for leaders or individual contributors to start building a team-centric culture. She also defines common barriers to collaboration, and describes methods to overcome those obstacles. Finally, hear about her practical approaches for breaking the ice in any room, and where to find fantastic and unexpected collaborators.</p><p>This course includes AI-powered Role Play. Role Play allows you to practice what you’ve learned in interactive simulations of real-world conversations.</p>",Course,2025-03-10 16:39 UTC,2025-03-07 21:45 UTC,false,N/A,
SSL Certificates for Web Developers,"All websites should be using secure connections over HTTPS by default. Web browsers have evolved and warn users whenever sites allow insecure connections. At the same time, the Let's Encrypt project has made it easy to install SSL certificates for free. In this course, instructor Kevin Skoglund explains what an SSL certificate is, how it is used to encrypt communications between a server and a browser, and how to choose the domain scope and validation type. He demonstrates how to install free certificates from Let's Encrypt using Certbot or install purchased certificates from a traditional certificate authority. He shows how to configure the web server to default to HTTPS and how HSTS directives can tell browsers to always use HTTPS.",Course,2025-08-02 12:22 UTC,N/A,true,N/A,
Windows Server 2022: DHCP and DNS,"DHCP is an important concept to understand for any network or system administrator, as it allows you to automatically assign IP address information to all your endpoints. DNS, meanwhile, is essential to resolve names to IP addresses to make Active Directory and name resolution work correctly. In this course, instructor Robert McMillen explains how DHCP and DNS work in the context of a Windows Server 2022 environment. He first shows how to install, manage, troubleshoot, and create all the DHCP settings needed for your network—even remote networks. He then covers the important aspects of DNS—installing, configuring, and troubleshooting Active Directory DNS and standard DNS zones. Robert ends the course with demonstrations on managing both DHCP and DNS using management consoles, PowerShell, IPAM, and Windows Admin Center.",Course,2022-12-23 00:30 UTC,N/A,false,N/A,
Building Accountability into Your Culture,"<p>Leaders must model accountability to the rest of the organization to create trust and establish their own credibility. Employees must be held accountable for their work, both as individuals and within teams. When leaders and employees are accountable, this creates a culture of accountability, which becomes part of the organization's brand promise. In this course, leadership consultant and executive coach Mike Figliuolo reveals how to create a culture of accountability by developing accountability at the individual level, team level, and brand level. Along the way, he shows how to set employee expectations, create incentives, and align the practice of accountability with the values of your organization.</p><p>This course includes AI-powered Role Play. Role Play allows you to practice what you’ve learned in interactive simulations of real-world conversations.</p>",Course,2025-07-31 01:58 UTC,2025-07-10 19:31 UTC,false,N/A,
Creating a Dev Environment in AWS with Terraform,"If you work in Azure development, this course from CloudSkills.io can show you some best practices for setting up a development environment in AWS. Instructor Philip Afable introduces you to Terraform and shows you how to download and start using it. Philip covers the Lambda function, including how to set it up, write it, troubleshoot it, and update it. He explains how to create a Simple Queue Service (SQS) queue and link this new queue to your Lambda function. Philip concludes with how you can use WorkSpaces and manage regions in your development and production environments.
<br><br>
Note: This course was created by CloudSkills.io. We are pleased to host this training in our library.",Course,2023-01-22 15:24 UTC,N/A,false,N/A,
Photoshop One-on-One: Mastery,"Discover how to be the best Photoshop user you know with reigning expert Deke McClelland. In this final installment of his comprehensive three-part <i>One-on-One</i> series, Deke explains how Photoshop works at its highest level. Get around Photoshop more quickly by loading dozens of new and revised keyboard shortcuts. Experience the power of Smart Filters, dynamic effects, and such seemingly mundane (but secretly awesome) topics as blur and noise. Discover how to mask images with the Calculations command, and manipulate paths with the Pen tool. Learn how to assemble 360° panoramas and work with such exotic features as layer comps, artboards, and actions. Leave each chapter with a sense of real accomplishment that you can apply to your own marketable, eye-popping artwork.",Course,2024-07-03 01:00 UTC,N/A,false,N/A,
Banish Your Inner Critic to Unleash Creativity (with Audio Descriptions),"<p>Imagine a world where you trusted your ideas and felt good about what you created. This world, where you can create more easily and more often, exists. Creativity evangelist Denise Jacobs is the founder and CEO of The Creative Dose, where she promotes techniques to unlock creativity and spark innovation in people, teams, and workplaces. In this course, Denise helps you silence the voice of self-doubt and start doing your best work now. Learn how to stop self-sabotage, kick-start idea generation, lose your fear of judgement, and build a fresh and improved mindset—the foundation for maximum unfettered creativity. By the end, you’ll have a roadmap of how to get unstuck, do your best work, and channel your creativity as a force for positive change in the world.</p><p>This course includes audio descriptions (AD). To view a version of this course without AD, see <a href=""https://www.linkedin.com/learning/banish-your-inner-critic-to-unleash-creativity-3/imagine-trusting-your-ideas-and-feeling-great-about-what-you-create?autoplay=true&resume=false&u=104"" target=""_blank""><i>Banish Your Inner Critic to Unleash Creativity</i></a>.</p>",Course,2026-05-03 01:43 UTC,N/A,false,N/A,
Nano Tips for Interpersonal Communication with Shadé Zahrai,"Welcome to our <i>Nano Tips</i> series, where LinkedIn Learning creators deliver impactful lessons in literally seconds.  In this course, award-winning leadership strategist and peak performance educator for Fortune 500 companies Shadé Zahrai shares tips for improving interpersonal communication skills. Shadé explains the importance of choosing words that foster collaboration, shows how you can transform your communication with positive reinforcement, describes the biggest conversation buzzkill, and more.",Course,2026-01-20 01:41 UTC,N/A,false,N/A,
Communicating with Executives,"<p>To communicate with executives effectively, you must learn to think like an executive and structure your information in a way that answers the key questions going through their mind. In this course, LinkedIn COO Dan Shapero shares his tips on the best ways to share ideas and updates with executives. Dan explains how to address, within the first 60 seconds of the conversation, what the executive wants to know: “Does it matter?” and if so, “How is it going?” He helps you understand how to serve their agenda, rather than furthering your own. Plus, Dan guides you through striking the right tone and energy levels, emphasizing accuracy and precision, and balancing your pitch effectively between generating energy and credibility.</p><p>This course is part of a <a href=""https://www.linkedin.com/learning/paths/succeeding-as-a-mid-career-manager-professional-certificate-by-linkedin-learning-24764049"" target=""_blank"">Professional Certificate</a> from LinkedIn Learning.</p>",Course,2023-06-15 22:52 UTC,N/A,false,N/A,
Cisco Certified Support Technician (CCST) Networking (100-150) Cert Prep,"The Cisco Certified Support Technician (CCST) Networking certification targets network professionals looking to build a comprehensive understanding of modern networking technologies and practices. This certification validates your skills and technical know-how with entry-level networking concepts and topics, including network operations, IP addressing, connecting network devices, media, network troubleshooting, and other fundamental protocols that enable network communications. An ideal fit for early-career IT pros, the CCST Networking certification is also the first step toward earning your official Cisco Certified Network Associate (CCNA) certification.",Course,2025-09-22 12:04 UTC,N/A,false,N/A,
CONTENT METADATA NO LONGER EXISTS - urn:li:lyndaCourse:2881066,CONTENT METADATA NO LONGER EXISTS - urn:li:lyndaCourse:2881066,Course,2022-12-15 15:24 UTC,N/A,false,N/A,
Nano Tips for More Effective Meetings with Shadé Zahrai,"Welcome to our <i>Nano Tips</i> series, where LinkedIn Learning creators deliver impactful lessons in literally seconds. In this course, peak performance researcher and behavioral strategist to Fortune 500 companies Shadé Zahrai shares quick tips for running more productive meetings. Shadé explains how to optimize meeting dynamics, maximize individual contributions, and strategically structure meetings for peak performance. Plus, learn how to continuously rate and improve your meetings.",Course,2026-01-09 02:55 UTC,N/A,false,N/A,
Cultivating Mental Agility,"In a fast-moving world full of rapid changes, we can't keep thinking the same old way. We have to challenge our ingrained thinking habits to become better and faster problem solvers and decision-makers, able to think strategically or tactically depending on what the situation calls for. Mental agility is what makes employees indispensable to companies and helps those companies stay relevant in the marketplace. In this course, Dorie Clark explains how to cultivate the mental agility required for a great career: from building resilience and learning from the past, to creating an organizational culture that thrives in the face of change.",Course,2025-07-25 09:58 UTC,2025-06-05 21:58 UTC,false,N/A,
Nano Tips for Effortless Influence with Shadé Zahrai,"Welcome to our Nano Tips series, where LinkedIn Learning creators deliver impactful lessons in literally seconds. In this course, peak performance researcher and behavioral strategist to Fortune 500 companies Shadé Zahrai shows you how to exude effortless influence. She starts with outlining the basics of influence, followed by sharing key influence tactics—leveraging social proof, offering choices, and influencing with emotional intelligence. Shadé then takes it up a level with some pro-level influence techniques, explaining how to influence those with greater authority and how to sway skeptics.",Course,2025-12-31 22:08 UTC,N/A,false,N/A,
BGP Essential Training,"Learn the fundamentals of Border Gateway Protocol (BGP)—the only exterior routing protocol used to exchange networks on the Internet—and learn how to configure it. Join instructor Jarrel Rivera as he shows you what BGP is all about, how it differs from other routing protocols, its various parameters, and how you can configure and apply BGP to your network. Jarrel also runs a number of BGP demonstrations, so you can see the lessons in action as you go along.",Course,N/A,N/A,true,N/A,
Unconscious Bias (with Audio Descriptions),"<p>To some degree, we are all biased. Our experiences shape who we are, and our dimensions of diversity—race, ethnicity, gender, height, weight, sexual orientation, place of birth, and other factors—impact the lens through which we view the world. In this course, through compelling examples that explore the most common forms of unconscious bias and its implications, diversity expert Stacey Gordon teaches you to recognize and acknowledge your own biases when making decisions, engaging with colleagues, and working effectively in today's organizations. Stacey reveals the most common forms of unconscious bias—affinity bias, halo bias, perception bias, confirmation bias, and group think—and teaches you the skills to effectively address them.</p>
<p>Note: This course includes audio descriptions (AD). To view a version of this course without AD, see <a href=""https://www.linkedin.com/learning/unconscious-bias-14822310/why-identify-your-bias?u=104"" target=""_blank""><i>Unconscious Bias</i></a>.</p>",Course,2026-04-04 21:55 UTC,N/A,false,N/A,
Linux Security and Hardening Essential Training,"Linux is a cornerstone OS, particularly for servers and network management. In this course, instructor Scott Simpson outlines the essentials of successfully securing and hardening a Linux server. Explore practical ways to mitigate some of Linux’s most common security weaknesses, as Scott shares step-by-step instructions for protecting your systems against an attack. Applicable for anyone looking to learn more about how to secure a Linux server, this course is ideal for aspiring and early-career Linux system administrators and engineers.",Course,2025-10-24 18:07 UTC,N/A,false,N/A,
OpenAI ChatGPT: Creating Custom GPTs,"GPTs allow you to create custom versions of ChatGPT with their own instructions, knowledge retrieval, and actions for highly specialized and targeted functionality using natural language instructions and basic uploads. In this course you’ll learn how to harness the power of custom GPTs for everything from small personal tasks to large enterprise use cases.",Course,2025-07-09 14:19 UTC,N/A,false,N/A,
Nano Tips for Leading with Influence with Kim Kaupe,"<p>Welcome to our Nano Tips series, where LinkedIn Learning creators deliver impactful lessons in literally seconds. Here, Kim Kaupe shows you how to lead with influence. Kim explains the difference between influence and authority and busts the myth that without a senior title, you have no control over what happens in the office. She provides tips on leading with positivity, asking good questions, and how you can step up and be seen as a leader. Kim highlights ways to think like an owner and influence others through service. Plus, she teaches you how to lead when you’re not in charge and how to learn from influential leaders. With these concise videos, you can make learning fit into even your busiest days!</p>

<p>This course was created by Kim Kaupe. We are pleased to host this training in our library.</p>",Course,2025-12-28 19:16 UTC,N/A,false,N/A,
How to Build a Secret Circle of Mentors,"Mentors play a crucial role in our lives. There are many different types of mentors you’ll encounter in your careers, and each will help you succeed in different ways. This audio-only course, adapted from the <i>Modern Mentor</i> podcast, identifies six types of “secret” mentors—people who can teach you critical skills from afar. Join Rachel Cooke as she defines various types of mentors, shares how you can seek them out, and explores what they can do to benefit your personal and professional life.


<br><br>

This course was created by Macmillan Publishers. We are pleased to offer this training in our library.",Course,2023-07-25 02:15 UTC,N/A,false,N/A,
Smart Brevity: The Power of Saying More with Less (Book Bite),"<p>Perhaps more than ever, brevity in communication is important. Being able to say more with less is a valuable skill in a world filled with short attention spans, limited space, and competition for eyeballs. Jim VandeHei, Mike Allen, and Roy Schwartz held brevity as a key value when they founded the media site Axios, where they focused on brief but impactful storytelling. They detailed this belief in their book, <i>Smart Brevity: The Power of Saying More with Less</i>. In this audiobook summary from Next Big Idea Club, co-author Mike Allen, shares some of the key insights from the book.
 </p><p>
This audiobook summary was created by Next Big Idea Club. We are pleased to host this content in our library.",Course,2025-10-30 03:19 UTC,2025-06-05 21:12 UTC,false,N/A,
Sustainable Employee Engagement,"At a time when burnout abounds, what can you do to keep your team engaged? In this course, author, educator, and coach Dr. Todd Dewett teaches you how to understand and build a highly engaged team and create sustained engagement. Todd has designed this content to help leaders at all levels, as well as individuals who aspire to lead. He addresses baseline issues like recognition and rewards, gamification, and removing pain points. Todd also focuses on higher-level tactics that lock in elevated levels of engagement and a few key practices that make engagement truly sustainable. He offers practical instruction and includes many actionable steps you can implement immediately to take your understanding of employee engagement to the next level.  
 <br><br>
Note: This course was created by Todd Dewett. We are pleased to host this training in our library.",Course,2024-10-22 19:39 UTC,N/A,false,N/A,
Learning Minitab (2021),"Dr. Richard Chua shows how to import and organize data; open, save, and share Minitab worksheets and projects; create graphs and charts; and use descriptive statistics and statistical tests in Minitab to make inferences and data-driven decisions. Then learn how to make inferences on continuous data—running normality tests, variance tests, correlations, and simple regression tests. Finally, discover how to share your findings with others using reports and simple copy-and-paste techniques. Start watching to learn why Minitab is one of the world's most popular statistical software tools.",Course,2025-02-02 17:06 UTC,N/A,true,N/A,
Hidden Genius: How Successful People Think (Book Bite),"<p>When we hear the word genius, we often think of some kind of extraordinary—perhaps even magical—human being. But what if genius isn’t an inherent quality but just a way of looking at the world—a way that you could learn to employ? In this audiobook summary, Polina Marinova Pompliano shares five key insights from her new book, <i>Hidden Genius: The secret ways of thinking that power the world’s most successful people</i>. Join Polina as she helps you unlock the genius within. Learn how manufacturing hardship leads to lasting mental toughness; how love is a skill that needs to be sharpened regularly; how to audit the information you put in your brain; the importance of tying your identity to your own name; and how your definition of success is personal and ever-changing.
</p><p>
Note: This audiobook summary was created by Next Big Idea Club. We are pleased to host this content in our library.",Course,2025-11-12 01:33 UTC,N/A,false,N/A,
Avoiding Phishing Scams,"It's easy to fall prey to phishing scams, even for the most tech-savvy computer user. In this short course, instructor Jess Stratton teaches you how to recognize the signs of a potential phishing scam, so that you can keep your computer safe from malicious attacks. Jess takes you through several phishing examples and explains how to look critically at the email you receive. She points out some of the most common scenarios used by hackers and other telltale signs of a phishing email and shows you how to protect your computer from email phishing scams.",Course,2025-10-02 18:13 UTC,N/A,false,N/A,
