Content Title,Content Description,Content Type,Content Last Watched Date (if viewed),Content Completed At (if completed),Content Saved,Notes taken on videos (if taken),
Persuasive Coaching,"Coaching is quickly replacing the performance review in most forward-thinking companies. Persuasive coaching teaches you how to incorporate basic psychological concepts throughout the coaching process to ensure a better, more effective coaching relationship. In this course you can learn core coaching skills, review the coaching process, and understand the psychology of persuasion. Instructor Brian Ahern provides tips to build relationships, enhance trust with your employees, and use feedback and accountability measure to enforce positive behavior changes. Case studies peppered throughout the course show you how to apply those skills in the coaching process.",Course,2022-10-21 19:39 UTC,N/A,false,N/A,
Complete Guide to Parallel and Concurrent Programming in Python,"Parallel programming unlocks a program’s ability to execute multiple instructions simultaneously, increases the overall processing throughput, and is key to writing faster and more efficient applications. In this course, join instructors Barron and Olivia Chiu Stone as they introduce the basics of parallel programming in Python, providing the foundational knowledge you need to write more efficient, performant code. Barron and Olivia explain concepts like threading and mutual exclusion in a fun and informative way, relating them to everyday activities you perform in the kitchen. To cement the ideas, they demo them in action using Python. Each lesson is short and practical, driving home the theory with hands-on techniques.",Course,2025-11-17 02:57 UTC,N/A,false,N/A,
Uncertain: The Wisdom and Wonder of Being Unsure,"<p>Most people often feel embarrassed about uncertainties or blind spots in their knowledge. But Maggie Jackson—a journalist who covers social trends, with a particular focus on technology’s impact on humanity—argues that, properly understood, our ignorance can be the secret to enhanced performance and groundbreaking ideas. In this audiobook summary, Maggie shares five big ideas from her book, <i>Uncertain: The Wisdom and Wonder of Being Unsure</i>.
 </p><p>
 
Note: This audiobook summary was created by Next Big Idea Club. We are pleased to host this content in our library.",Course,2025-10-15 17:41 UTC,N/A,false,N/A,
Recruiting Techniques to Reveal Transferable Skills,"When filling opening job requisitions, do you often feel constricted by searching a pool of candidates filtered by job title or by specific industries? Imagine how satisfying it would be to have access to a larger pool of talent, one that might not be on the radar of your competitors. In this course, Barbara Bruno shows you how to identify top candidates based on the skills they have that will transfer to the jobs you need to fill, regardless of their previous titles or professional experience. Barbara explains how to identify transferable skills, revise your job requisition, and how to modify your interviewing and hiring processes. By focusing on transferable skills, you can provide your company with a tremendous competitive advantage—one that will fill open requisitions faster, help candidates advance in their career, and improve engagement and retention.",Course,2025-01-25 16:02 UTC,N/A,false,N/A,
"Leadership Tips, Tactics, and Advice","Lead with intention using the leadership tips, tactics, and advice in this audio-only course. Lisa Earle McLeod and Elizabeth Lotardo explain how to develop a leadership mindset, thrive in crucial leadership moments and challenges, and build a winning team. Discover how to master the leadership opportunities you have at every turn: to set direction, build a strong team, and make a lasting impact on your entire organization. By the end of this course, you'll learn how to manage your mindset and behaviors to be a leader others will want to follow.",Course,2022-09-08 17:38 UTC,N/A,true,N/A,
Mitigating Cybersecurity Vulnerabilities,"Cybersecurity teams must be able to identify, mitigate, and manage cybersecurity vulnerabilities. In this course, information security expert Kip Boyle equips you with the practical advice and strategies that you need. Gain an understanding of common vulnerabilities. Find out how to decide whether to fix or mitigate these vulnerabilities, as well as how to prioritize them. Go over ways to overcome roadblocks and manage expectations. Learn how to automate patch management. Plus, explore the best ways to report progress and results to senior decision-makers.",Course,2025-03-10 14:35 UTC,2025-02-04 03:48 UTC,false,N/A,
"Diversity, Inclusion, and Belonging","<p>Diversity is having a culture that values uniqueness: people of different backgrounds, cultures, genders, and races. Inclusion means inviting diverse groups to take part in company life. If you're tuned into conversations about HR, you've probably heard these terms before. But there's a third critical piece: belonging. It's belonging that makes each individual feel accepted for who they are. Explore the diversity, inclusion, and belonging (DIB) approach, and discover how to activate it in your organization. Join HR luminary Pat Wadors as she explains how to drive the conversation on DIBs, hire and retain diverse talent, listen to employees, and integrate DIBs into your employee lifecycle. Managers and executives should tune in for special tips on embedding DIBs in the employee experience.</p><p>This course is part of a <a href=""https://www.linkedin.com/learning/paths/succeeding-as-a-new-manager-professional-certificate-by-linkedin-learning?u=104"" target=""_blank"">Professional Certificate</a> from LinkedIn Learning.</p>",Course,2025-02-15 15:18 UTC,N/A,false,N/A,
Managing Projects with Microsoft 365,"<p>As a project manager, you likely know the importance of being able to stay on top of every last thing—and what a challenge that can be. However, this course provides you with the skills you need to manage projects more effectively by using Microsoft 365. Instructor Christine Matheney first shares the value that Microsoft Lists can provide, and shows the steps to get started using it. Christine then dives into using Microsoft Planner to help you create your project plan and manage it over time. Next, Christine reviews how you can take your project management a step further using Microsoft Project, including features that allow you to incorporate different project management approaches and methodologies. Finally, Christine reiterates common use cases for each specific project management to ensure you can feel confident in the tools you're using depending on what you're trying to achieve. If you want to organize, plan, and execute projects and track insights with ease, check out this course. </p><p>This course is part of this <a href=""https://www.linkedin.com/learning/paths/career-essentials-in-business-analysis-by-microsoft-and-linkedin"">Professional Certificate</a> and this <a href=""https://www.linkedin.com/learning/paths/career-essentials-in-project-management-by-microsoft-and-linkedin"" target=""_blank"">Professional Certificate</a> from Microsoft.</p>",Course,2025-03-10 02:13 UTC,N/A,true,N/A,
Nano Tips to Project Confidence and Executive Presence with Shadé Zahrai,"<p>Welcome to our Nano Tips series, where LinkedIn Learning creators deliver impactful lessons in literally seconds. In this course, behavioral strategist and global peak performance consultant to Fortune 500 companies Shadé Zahrai shows you frameworks that will support you in building genuine connections, speaking with precision, and maintaining poise. Learn ways to project confidence in your communication, refine your presence using concise messages, and reinforce your credibility through a confident posture. Plus, learn to amplify your influence with  a positive presence, asking thoughtful questions, and communicating with credibility.</p>

<p>This course was created by Shadé Zahrai. We are pleased to host this training in our library.</p>",Course,2026-01-13 01:42 UTC,N/A,false,N/A,
Quantum Cryptography and the Future of Cybersecurity,"The frequency and severity of hacking and other attacks on our information systems are increasing. Despite remarkable progress in cybersecurity innovation, too many vulnerabilities continue to exist, and the threats are increasingly sophisticated. Quantum cryptography may offer some optimism in the long term. By leveraging the fundamentals of quantum mechanics, this set of emerging technologies allows information to be protected in novel new ways. Consequently, it's poised to shake up the world of information security. In this course, Jonathan Reichental lays out what quantum cryptography is, as well as the journey ahead to operationally realize quantum-based encrypted communications.",Course,2025-06-13 11:18 UTC,N/A,false,N/A,
CompTIA Security+ (SY0-701) Cert Prep (2024),"CompTIA Security+ is an entry-level certification that requires a thorough understanding of network and device security, risk mitigation strategies, compliance, and more. This course provides CompTIA Security+ candidates with essential information they need to prepare for the qualifying exam. Cybersecurity expert Mike Chapple first goes over some of the basics of the exam, then covers the six domains for the latest version of the exam, SY0-701. He shares study tips that can help you feel prepared to take and pass the test on your first try. Plus, learn where to find practice tests to get hands-on experience and how to keep your certification current by continuing your studies.",Course,2025-10-17 10:58 UTC,N/A,false,N/A,
Smarter Thinking and Better Living in an AI World: A Conversation with Daniel Pink,"In this interview-driven course featuring best-selling author Daniel Pink, you’ll be treated to an engaging conversation on the intersection of human potential and AI. Discover how timeless principles like optimizing timing, fostering creativity, and building resilience align with cutting-edge AI tools to transform the way we think, work, and live. From smart strategies for productivity and decision-making to the art of human connection in an AI-driven world, this interview will inspire you to unlock new possibilities and lead a more purposeful life.",Course,2025-02-12 19:29 UTC,N/A,false,N/A,
Resume Rules for 2026 with Jenny Foss,"<p>In a highly competitive job market shaped by AI and evolving career paths, what works on a resume right now?</p>

<p>According to <a href=""https://news.linkedin.com/2026/LinkedIn-Research-Talent-2026"" target=""_blank""><b>LinkedIn research</b></a>, more than half of US professionals plan to look for a new job in 2026, and applicants per role have doubled since 2022. Standing out has never mattered more.</p>

<p>In this conversation with LinkedIn editor at large Andrew Seaman, career consultant and job search expert Jenny Foss shares what it takes to get your resume seen and read. She’s helped everyone from new grads to senior leaders at companies like Nike, Intel, Google, and Disney get noticed and make career moves that matter. Now, she’s pulling back the curtain on what works and why.</p>

<p>This is a recording of a live event and features audience participation and an unscripted Q&A. Visit <a href=""http://linkedin.com/events"" target=""_blank""><b>linkedin.com/events</b></a> for more can’t-miss conversations featuring prominent leaders.</p>",Course,2026-05-10 18:37 UTC,N/A,false,N/A,
Advanced BGP,"Border gateway protocol—or BGP, for short—is the primary routing protocol that’s used to exchange networks and manage traffic on the internet. You might already know what BGP is, or even how to effectively configure it. But if you’re looking to learn more about advanced techniques, this course was designed just for you.<br><br>Join instructor Jarrel Rivera as he covers the more advanced BGP configurations. Explore a wide variety of configuration options that you can apply directly to your networks, including route reflectors, confederations, aggregate addresses, and more. Along the way, Jarrel shows you how to filter BGP routes using access lists, prefix-lists, and route maps, sharing practical tips for best path selection with path attributes like weight, local preference, AS path, and multi-exit discriminator. Upon completing this course, you’ll be ready to apply the commands you’ve learned and become a more nuanced network administrator.",Course,2023-02-06 17:02 UTC,N/A,false,N/A,
Nano Tips for Communicating with Confidence with Selena Rezvani,"Welcome to our <i>Nano Tips</i> series, where LinkedIn Learning creators deliver impactful lessons in literally seconds.<br><br>Here, join instructor Selena Rezvani as she lays out how to communicate with confidence and make sure that your voice is fully heard in any situation. Explore words that raise your stature and three practical shifts to be more assertive. Develop skills to communicate comfortably and confidently with your managers and colleagues—but also with yourself. Plus, learn how to address challenges with overtalkers, disagreement, overthinking, overexplaining, conflict on the job, and being overworked. Each video is just under a minute long, so you can make learning fit into even your busiest days.",Course,2022-12-02 13:55 UTC,N/A,false,N/A,
Creating a High Performance Culture,"If you're a leader, you're responsible for establishing the culture in your organization. In order to remain competitive, you need to build a culture of high performance. In this course, executive coach and consultant Mike Figliuolo reveals how to define your organization's culture, set direction, manage organizational performance, and ensure the right platforms and processes are in place to reinforce the culture. Throughout the course, Mike brings this topic to life by sharing actionable tips and real-world examples.",Course,2025-09-23 20:59 UTC,2025-09-23 20:53 UTC,false,N/A,
Security Frameworks Fundamentals,"<p>Security has become a topic of conversation in every company's boardroom, and security frameworks give you a common language and a standard set of best practices for these conversations. In this course, Mandy Huth, the vice president of cybersecurity at Kohler, Co., covers the four primary frameworks, how they map to each other, and how to optimize them based on their relevance for your organization. Mandy presents some useful definitions, then dives into the major security frameworks, including domain-specific frameworks, maturity frameworks, privacy frameworks, and regulatory frameworks. She shows you how to perform risk assessment, then deep dives into security frameworks and compares different frameworks. Plus, Mandy explains in detail the core security set.</p>",Course,2025-04-21 20:37 UTC,2025-04-21 19:32 UTC,false,N/A,
Creating Accessible and Inclusive Video,"<p>Prioritizing accessibility throughout the production process is essential for creating inclusive video content. In this course, join LinkedIn Learning staff instructor Ashley Kennedy to learn how to create video projects that are accessible to the widest possible audience and that reflect best practices for promoting inclusion—from casting and crew selection to writing, editing, and fine-tuning assets and scripts.</p><p>Explore the fundamentals of why you should focus on creating more accessible and more inclusive video content. Get started curating video experiences and forming connections with a wide variety of audiences, planning and testing for accessibility along the way. Ashley offers insights and practical strategies to create inclusive video content that features a diverse array of topics, curates scripts and content with diversity and inclusion in mind, recruits and casts diverse crew and talent, avoids jargon and insider terms, and more.</p>",Course,2024-04-01 14:40 UTC,N/A,false,N/A,
Speaking Confidently and Effectively,"The ability to present yourself and communicate well is crucial in any work environment. In this course, adapted from the podcast <i>How to Be Awesome at Your Job</i>, learn how to build on your presentation skills to gain a competitive advantage in your career. Professional speaker Diane DiResta shares tips and tricks for leveling up your presentations and boosting your executive presence. Learn how to craft your presentations around what’s important to the audience to ensure that you're only sharing the most impactful information. Discover how to shift your focus away from yourself to conquer your fear of speaking. Plus, get strategies for ensuring that your body, tone, and words are giving off one consistent message; planning for your worst-case scenario and establishing recovery strategies; handling tough questions; and more.<br><br>This course was created by Pete Mockaitis of <i><a href=""https://awesomeatyourjob.com/"" target=""_blank"">How to Be Awesome at Your Job</i></a>. We are pleased to offer this training in our library.<br><br><img src=""https://media.licdn.com/media/AAYAAgCwAAoAAQAAAAAAAIBpAic0FsSvQXaA8NB7qnVcIw.jpg"" alt=""Company logo for How to Be Awesome at Your Job"" width=""20%"" height=""20%""/>",Course,2022-09-12 11:23 UTC,N/A,false,N/A,
Developing Your Leadership Philosophy,"<p>If you want your team to trust you as a leader, it's important to articulate who you are, what you stand for, and why you're excited to lead them. In this course, author and executive leadership coach Mike Figliuolo shows you how to distill your leadership philosophy down to one simple page covering four critical aspects of leadership: leading yourself, leading the thinking, leading your people, and leading a balanced life. Get hands-on with introspective exercises that help you define and practice leading authentically, with a style that's uniquely yours. Along the way, discover how to share and socialize your vision, make decisions, motivate and mentor, and keep your whole life in perspective. </p><p>This course includes AI-powered Role Play. Role Play allows you to practice what you’ve learned in interactive simulations of real-world conversations. </p>",Course,2026-01-24 01:52 UTC,N/A,false,N/A,
AWS Certified Cloud Practitioner (CLF-C01) Cert Prep: 1 Cloud Concepts,"Amazon Web Services (AWS)—and cloud computing in general—can be difficult for people without technical backgrounds to decipher. This introductory course is a bridge between non-engineers and the cloud. It is the first in a four-part series designed to help professionals in non-technical roles, including finance teams, project managers, and marketers, make the best use of AWS. Instructor Hiroko Nishimura—founder of Intro to AWS for Newbies—provides a brief history of cloud computing, an overview of cloud deployment models, and a summary of cloud design principles. She then shows how to create an account and start using the AWS Free Tier to gain hands-on experience with AWS products and services. Plus, get exam tips and learn about resources for professionals studying for the AWS Certified Cloud Practitioner exam.<br/><br/>Note: This course also maps to the first domain of the AWS Certified Cloud Practitioner exam. Taking all four courses in the <i>Introduction to AWS for Non-Engineers</i> series will help you prepare for the exam.",Course,2022-10-05 15:24 UTC,N/A,false,N/A,
Microsoft 365 Administrator Expert (MS-102) Cert Prep by Microsoft Press,"<p>If you are a Microsoft 365 administrator who performs tenant-level implementation and administration of cloud and hybrid environments, earning the Microsoft 365 Administrator Expert (MS-102) certification can move your career forward. The Microsoft 365 Administrator Expert (MS-102) exam measures your ability to: deploy and manage a Microsoft 365 tenant; implement and manage identity and access in Azure AD; manage security and threats by using Microsoft 365 Defender; and manage compliance by using Microsoft Purview. This course helps you prepare for the exam.</p><p>This course was created by Microsoft Press. We are pleased to host this training in our library.</p>",Course,2025-06-30 00:02 UTC,N/A,false,N/A,
"Change Management Success: The People, Processes, and Communication","<p>All too often, change work is unsuccessful, but that’s not because of a lack of effort or vision. Rather, what’s most important is how you understand the effects of certain changes so you can address them as you go. In this course, join instructor Jamie Champagne and take a deep dive into change work, its benefits, key challenges, and how to avoid making business-critical mistakes that can derail your teams, stakeholders, and projects.</p><p>Get tips on identifying assumptions with your stakeholders and their attitudes towards your work. Jamie shows you how to properly define, articulate, and manage work processes that have a fundamental impact on your work, as well as develop and connect impactful approaches to ensure your success—before, during, and after the change work is complete. By the end of this course, you’ll be prepared to shift your perspective on the go to get additional buy-in and support for new ventures.</p>",Course,2026-04-25 10:36 UTC,2026-03-18 20:23 UTC,false,N/A,
Nano Tips for Negotiating Your Salary with Sho Dewan,"<p>Welcome to our <i>Nano Tips</i> series, where LinkedIn Learning creators deliver impactful lessons in literally seconds. In this installment, discover the secrets to navigating a successful salary negotiation, with key insights from Sho Dewan, the CEO and founder of Workhap and a LinkedIn Top Voice in Job Search and Careers.</p><p>Learn the essentials of talking about salary so you know what to say when it counts. Find out how to research salaries, work closely with recruiters, share your salary expectations, and consider your compensation package beyond just the numbers. Sho walks you through the three most important things to know before you even start the negotiation, with pointers on how to make a counteroffer that’s fair to you and competitive with the market. Along the way, Sho also tells what to say when you’re ready to ask for a raise.</p>",Course,2022-09-19 13:03 UTC,N/A,false,N/A,
"Advanced Go Programming: Data Structures, Code Architecture, and Testing","Looking to advance your skills in Go, the popular open-source programming language? Join instructor Adelina Simion in this hands-on, interactive, skills-first coding course designed uniquely for intermediate- to advanced-level Go developers. Discover practical tips and techniques used by expert programmers to boost your technical know-how or prepare for an interview to land a new role in your field. This course includes Code Challenges powered by CoderPad: interactive coding exercises with real-time feedback, so you can get hands-on coding practice to advance your coding skills. Adelina helps you develop your skills as a Go programmer with four specific, query-focused coding challenges. Practice using common data structures, streams, robust code, and dynamic programming.",Course,2024-05-09 23:15 UTC,N/A,false,N/A,
Nano Tips to Build Authority on LinkedIn with Shadé Zahrai & Jasmin Alić,"Welcome to our <i>Nano Tips</i> series, where LinkedIn Learning creators deliver impactful lessons in literally seconds. In this course, Shadé Zahrai and Jasmin Alić show you how to create impactful LinkedIn content that delivers real value, builds engagement, and strengthens professional connections. Develop skills to format posts effectively, engage with comments, and subtly showcase their expertise without sounding overly promotional. Through storytelling, video strategies, and permission-based selling, learn how to enhance your LinkedIn presence and create content that resonates with your audience.",Course,2025-10-11 22:27 UTC,N/A,false,N/A,
Carter Beauford: Under the Table and Drumming,"Learn drumming from a world-class musician. Carter Beauford, world-famous drummer for the Dave Matthews Band, performs along with the rhythm tracks from six of the band's best songs, including ""Ants Marching"" and ""Satellite."" Carter covers such topics as left-hand lead and open-hand approaches, fills, double-bass drums, drum set and cymbal setup, time feel, background and influences, and more. He also discusses the early days of the Dave Matthews Band. These lessons are valuable for drummers of all levels, as well as any musician who plays or programs drums.<br><br>

This course was created by Alfred Music. We are pleased to offer this training in our library.",Course,2023-03-24 14:47 UTC,N/A,false,N/A,
